{
  "specVersion": "0.1.0",
  "kind": "relational",
  "database": {
    "product": "postgresql"
  },
  "schemas": [
    {
      "name": "public",
      "tables": [
        {
          "name": "customers",
          "columns": [
            {
              "name": "id",
              "ordinal": 1,
              "nullable": false,
              "typeInfo": {
                "type": "int64",
                "nativeType": "bigint"
              }
            },
            {
              "name": "email",
              "ordinal": 2,
              "nullable": false,
              "typeInfo": {
                "type": "string",
                "nativeType": "text"
              }
            },
            {
              "name": "full_name",
              "ordinal": 3,
              "nullable": false,
              "typeInfo": {
                "type": "string",
                "nativeType": "text"
              }
            },
            {
              "name": "referred_by",
              "ordinal": 4,
              "nullable": true,
              "typeInfo": {
                "type": "int64",
                "nativeType": "bigint"
              }
            },
            {
              "name": "created_at",
              "ordinal": 5,
              "nullable": false,
              "typeInfo": {
                "type": "timestamptz",
                "nativeType": "timestamp with time zone",
                "fractionalDigits": 6
              }
            }
          ],
          "primaryKey": {
            "name": "customers_pkey",
            "columns": [
              "id"
            ]
          },
          "foreignKeys": [
            {
              "name": "customers_referred_by_fkey",
              "columns": [
                "referred_by"
              ],
              "referencedSchema": "public",
              "referencedTable": "customers",
              "referencedColumns": [
                "id"
              ],
              "onDelete": "no-action",
              "onUpdate": "no-action"
            }
          ],
          "uniqueConstraints": [
            {
              "name": "customers_email_key",
              "columns": [
                "email"
              ]
            }
          ]
        },
        {
          "name": "order_items",
          "columns": [
            {
              "name": "order_id",
              "ordinal": 1,
              "nullable": false,
              "typeInfo": {
                "type": "int64",
                "nativeType": "bigint"
              }
            },
            {
              "name": "line_no",
              "ordinal": 2,
              "nullable": false,
              "typeInfo": {
                "type": "int64",
                "nativeType": "integer"
              }
            },
            {
              "name": "product_id",
              "ordinal": 3,
              "nullable": false,
              "typeInfo": {
                "type": "int64",
                "nativeType": "bigint"
              }
            },
            {
              "name": "quantity",
              "ordinal": 4,
              "nullable": false,
              "typeInfo": {
                "type": "int64",
                "nativeType": "integer"
              }
            },
            {
              "name": "unit_price",
              "ordinal": 5,
              "nullable": false,
              "typeInfo": {
                "type": "decimal",
                "nativeType": "numeric(12,2)",
                "precision": 12,
                "scale": 2
              }
            }
          ],
          "primaryKey": {
            "name": "order_items_pkey",
            "columns": [
              "order_id",
              "line_no"
            ]
          },
          "foreignKeys": [
            {
              "name": "order_items_order_id_fkey",
              "columns": [
                "order_id"
              ],
              "referencedSchema": "public",
              "referencedTable": "orders",
              "referencedColumns": [
                "id"
              ],
              "onDelete": "no-action",
              "onUpdate": "no-action"
            },
            {
              "name": "order_items_product_id_fkey",
              "columns": [
                "product_id"
              ],
              "referencedSchema": "public",
              "referencedTable": "products",
              "referencedColumns": [
                "id"
              ],
              "onDelete": "no-action",
              "onUpdate": "no-action"
            }
          ],
          "uniqueConstraints": []
        },
        {
          "name": "orders",
          "columns": [
            {
              "name": "id",
              "ordinal": 1,
              "nullable": false,
              "typeInfo": {
                "type": "int64",
                "nativeType": "bigint"
              }
            },
            {
              "name": "customer_id",
              "ordinal": 2,
              "nullable": false,
              "typeInfo": {
                "type": "int64",
                "nativeType": "bigint"
              }
            },
            {
              "name": "status",
              "ordinal": 3,
              "nullable": false,
              "typeInfo": {
                "type": "string",
                "nativeType": "text"
              }
            },
            {
              "name": "placed_at",
              "ordinal": 4,
              "nullable": false,
              "typeInfo": {
                "type": "timestamptz",
                "nativeType": "timestamp with time zone",
                "fractionalDigits": 6
              }
            }
          ],
          "primaryKey": {
            "name": "orders_pkey",
            "columns": [
              "id"
            ]
          },
          "foreignKeys": [
            {
              "name": "orders_customer_id_fkey",
              "columns": [
                "customer_id"
              ],
              "referencedSchema": "public",
              "referencedTable": "customers",
              "referencedColumns": [
                "id"
              ],
              "onDelete": "no-action",
              "onUpdate": "no-action"
            }
          ],
          "uniqueConstraints": []
        },
        {
          "name": "products",
          "columns": [
            {
              "name": "id",
              "ordinal": 1,
              "nullable": false,
              "typeInfo": {
                "type": "int64",
                "nativeType": "bigint"
              }
            },
            {
              "name": "sku",
              "ordinal": 2,
              "nullable": false,
              "typeInfo": {
                "type": "string",
                "nativeType": "text"
              }
            },
            {
              "name": "name",
              "ordinal": 3,
              "nullable": false,
              "typeInfo": {
                "type": "string",
                "nativeType": "text"
              }
            },
            {
              "name": "price",
              "ordinal": 4,
              "nullable": false,
              "typeInfo": {
                "type": "decimal",
                "nativeType": "numeric(12,2)",
                "precision": 12,
                "scale": 2
              }
            },
            {
              "name": "parent_product_id",
              "ordinal": 5,
              "nullable": true,
              "typeInfo": {
                "type": "int64",
                "nativeType": "bigint"
              }
            }
          ],
          "primaryKey": {
            "name": "products_pkey",
            "columns": [
              "id"
            ]
          },
          "foreignKeys": [
            {
              "name": "products_parent_product_id_fkey",
              "columns": [
                "parent_product_id"
              ],
              "referencedSchema": "public",
              "referencedTable": "products",
              "referencedColumns": [
                "id"
              ],
              "onDelete": "no-action",
              "onUpdate": "no-action"
            }
          ],
          "uniqueConstraints": [
            {
              "name": "products_sku_key",
              "columns": [
                "sku"
              ]
            }
          ]
        }
      ]
    }
  ]
}
